{"loess":[{"band_hi":{"1951-1980":[null,null,null,null,null,null,null,null,null,null,null,null,null,null,null,null,null,null,null,null,null,null,null,null,null,null,null,null,null,null,-0.105,-0.114,-0.124,-0.133,-0.144,-0.153,-0.162,-0.171,-0.178,-0.183,-0.188,-0.192,-0.195,-0.197,-0.199,-0.203,-0.205,-0.21,-0.215,-0.22,-0.226,-0.232,-0.236,-0.239,-0.246,-0.253,-0.257,-0.257,-0.258,-0.262,-0.262,-0.264,-0.263,-0.26,-0.258,-0.252,-0.249,-0.243,-0.239,-0.23,-0.226,-0.216,-0.207,-0.196,-0.187,-0.178,-0.169,-0.157,-0.144,-0.131,-0.118,-0.106,-0.095,-0.082,-0.071,-0.058,-0.049,-0.039,-0.031,-0.02,-0.011,-0.001,0.006,0.011,0.015,0.018,0.021,0.023,0.026,0.026,0.025,0.022,0.022,0.022,0.022,0.021,0.02,0.017,0.015,0.013,0.014,0.015,0.018,0.022,0.027,0.03,0.037,0.044,0.052,0.059,0.068,0.078,0.09,0.103,0.117,0.13,0.141,0.153,0.167,0.182,0.197,0.213,0.23,0.247,0.263,0.278,0.295,0.311,0.327,0.345,0.359,0.377,0.394,0.412,0.431,0.45,0.47,0.486,0.505,0.522,0.542,0.561,0.582,0.603,0.624,0.646,0.668,0.691,0.713,0.735,0.76,0.785,0.809,0.832,0.859,0.889,0.92,0.949,0.98,1.011,1.045,1.078,1.11,1.142,1.175,1.211],"1991-2020":[null,null,null,null,null,null,null,null,null,null,null,null,null,null,null,null,null,null,null,null,null,null,null,null,null,null,null,null,null,null,-0.716,-0.726,-0.735,-0.744,-0.755,-0.765,-0.774,-0.783,-0.79,-0.795,-0.8,-0.804,-0.807,-0.809,-0.81,-0.814,-0.817,-0.821,-0.827,-0.832,-0.838,-0.843,-0.848,-0.851,-0.857,-0.865,-0.869,-0.869,-0.87,-0.873,-0.873,-0.876,-0.874,-0.872,-0.869,-0.863,-0.861,-0.855,-0.851,-0.842,-0.837,-0.827,-0.819,-0.807,-0.798,-0.789,-0.781,-0.769,-0.755,-0.743,-0.729,-0.717,-0.707,-0.694,-0.683,-0.67,-0.661,-0.65,-0.642,-0.632,-0.623,-0.613,-0.605,-0.601,-0.597,-0.594,-0.591,-0.588,-0.586,-0.585,-0.586,-0.59,-0.59,-0.59,-0.59,-0.59,-0.592,-0.594,-0.597,-0.598,-0.598,-0.596,-0.594,-0.589,-0.585,-0.581,-0.574,-0.567,-0.559,-0.552,-0.543,-0.534,-0.521,-0.509,-0.495,-0.481,-0.471,-0.458,-0.444,-0.43,-0.414,-0.398,-0.381,-0.365,-0.349,-0.333,-0.317,-0.3,-0.285,-0.267,-0.252,-0.234,-0.218,-0.2,-0.181,-0.161,-0.142,-0.125,-0.107,-0.09,-0.07,-0.05,-0.03,-0.009,0.012,0.035,0.057,0.08,0.102,0.124,0.149,0.173,0.198,0.221,0.247,0.278,0.308,0.337,0.369,0.399,0.433,0.467,0.498,0.531,0.564,0.599]},"band_lo":{"1951-1980":[null,null,null,null,null,null,null,null,null,null,null,null,null,null,null,null,null,null,null,null,null,null,null,null,null,null,null,null,null,null,-0.276,-0.274,-0.273,-0.271,-0.269,-0.269,-0.268,-0.268,-0.266,-0.266,-0.268,-0.272,-0.277,-0.28,-0.286,-0.29,-0.295,-0.298,-0.302,-0.307,-0.31,-0.315,-0.322,-0.326,-0.332,-0.335,-0.339,-0.341,-0.341,-0.342,-0.343,-0.345,-0.345,-0.343,-0.341,-0.338,-0.332,-0.327,-0.323,-0.317,-0.31,-0.303,-0.294,-0.285,-0.275,-0.264,-0.252,-0.239,-0.227,-0.216,-0.203,-0.19,-0.178,-0.167,-0.156,-0.145,-0.133,-0.121,-0.112,-0.104,-0.097,-0.089,-0.084,-0.079,-0.076,-0.074,-0.071,-0.07,-0.07,-0.069,-0.068,-0.069,-0.069,-0.07,-0.07,-0.072,-0.072,-0.071,-0.071,-0.069,-0.067,-0.066,-0.064,-0.06,-0.057,-0.053,-0.047,-0.042,-0.034,-0.026,-0.016,-0.007,0.003,0.012,0.025,0.037,0.05,0.065,0.08,0.096,0.112,0.13,0.146,0.161,0.177,0.193,0.209,0.228,0.246,0.262,0.277,0.294,0.311,0.329,0.347,0.364,0.382,0.4,0.418,0.437,0.457,0.477,0.497,0.517,0.537,0.557,0.579,0.603,0.627,0.65,0.673,0.699,0.727,0.754,0.78,0.805,0.829,0.854,0.877,0.901,0.926,0.949,0.973,0.995,1.016,1.038],"1991-2020":[null,null,null,null,null,null,null,null,null,null,null,null,null,null,null,null,null,null,null,null,null,null,null,null,null,null,null,null,null,null,-0.887,-0.885,-0.884,-0.882,-0.881,-0.88,-0.88,-0.879,-0.878,-0.878,-0.88,-0.884,-0.889,-0.892,-0.897,-0.902,-0.907,-0.909,-0.913,-0.918,-0.922,-0.926,-0.933,-0.938,-0.943,-0.947,-0.95,-0.953,-0.953,-0.954,-0.954,-0.956,-0.956,-0.955,-0.953,-0.949,-0.944,-0.939,-0.934,-0.928,-0.922,-0.914,-0.906,-0.896,-0.886,-0.876,-0.863,-0.851,-0.838,-0.827,-0.814,-0.801,-0.79,-0.779,-0.767,-0.757,-0.745,-0.733,-0.724,-0.716,-0.708,-0.7,-0.695,-0.691,-0.688,-0.686,-0.683,-0.682,-0.681,-0.681,-0.68,-0.68,-0.68,-0.681,-0.681,-0.683,-0.683,-0.683,-0.683,-0.68,-0.678,-0.677,-0.676,-0.672,-0.669,-0.664,-0.659,-0.653,-0.645,-0.637,-0.628,-0.618,-0.609,-0.6,-0.586,-0.574,-0.561,-0.547,-0.532,-0.516,-0.5,-0.482,-0.466,-0.45,-0.434,-0.418,-0.402,-0.384,-0.366,-0.35,-0.334,-0.317,-0.3,-0.282,-0.265,-0.247,-0.23,-0.212,-0.193,-0.175,-0.154,-0.135,-0.115,-0.094,-0.075,-0.055,-0.033,-0.008,0.015,0.039,0.062,0.087,0.115,0.142,0.169,0.194,0.218,0.242,0.265,0.29,0.314,0.338,0.361,0.384,0.405,0.426]},"block_len":10,"fit":{"1951-1980":[null,null,null,null,null,null,null,null,null,null,null,null,null,null,null,null,null,null,null,null,null,null,null,null,null,null,null,null,null,null,-0.207,-0.209,-0.212,-0.214,-0.217,-0.219,-0.221,-0.223,-0.225,-0.227,-0.229,-0.231,-0.234,-0.236,-0.237,-0.239,-0.242,-0.246,-0.251,-0.258,-0.266,-0.274,-0.281,-0.287,-0.294,-0.3,-0.307,-0.313,-0.319,-0.324,-0.327,-0.329,-0.329,-0.326,-0.322,-0.315,-0.307,-0.298,-0.289,-0.28,-0.27,-0.261,-0.252,-0.244,-0.237,-0.23,-0.221,-0.212,-0.2,-0.186,-0.172,-0.156,-0.139,-0.121,-0.104,-0.088,-0.073,-0.06,-0.049,-0.039,-0.031,-0.023,-0.017,-0.013,-0.01,-0.008,-0.007,-0.008,-0.01,-0.013,-0.017,-0.022,-0.027,-0.031,-0.035,-0.038,-0.04,-0.04,-0.039,-0.037,-0.035,-0.032,-0.028,-0.025,-0.022,-0.019,-0.016,-0.012,-0.007,-0.001,0.007,0.017,0.028,0.041,0.054,0.069,0.085,0.101,0.118,0.135,0.153,0.17,0.187,0.204,0.221,0.238,0.255,0.271,0.287,0.302,0.317,0.333,0.349,0.367,0.385,0.404,0.423,0.442,0.46,0.478,0.495,0.513,0.531,0.55,0.571,0.592,0.614,0.636,0.659,0.681,0.703,0.726,0.753,0.781,0.809,0.838,0.866,0.896,0.925,0.955,0.985,1.015,1.045,1.075,1.106,1.137],"1991-2020":[null,null,null,null,null,null,null,null,null,null,null,null,null,null,null,null,null,null,null,null,null,null,null,null,null,null,null,null,null,null,-0.818,-0.821,-0.824,-0.826,-0.828,-0.83,-0.832,-0.834,-0.836,-0.838,-0.841,-0.843,-0.845,-0.847,-0.848,-0.85,-0.853,-0.857,-0.863,-0.869,-0.877,-0.885,-0.892,-0.899,-0.905,-0.912,-0.918,-0.925,-0.931,-0.935,-0.939,-0.94,-0.94,-0.938,-0.933,-0.926,-0.918,-0.91,-0.901,-0.891,-0.882,-0.872,-0.864,-0.856,-0.848,-0.841,-0.833,-0.823,-0.811,-0.798,-0.783,-0.767,-0.75,-0.733,-0.716,-0.699,-0.684,-0.671,-0.66,-0.651,-0.642,-0.635,-0.629,-0.624,-0.621,-0.619,-0.619,-0.619,-0.622,-0.625,-0.629,-0.633,-0.638,-0.643,-0.646,-0.649,-0.651,-0.652,-0.651,-0.649,-0.646,-0.643,-0.64,-0.637,-0.634,-0.631,-0.628,-0.624,-0.619,-0.612,-0.605,-0.595,-0.584,-0.571,-0.557,-0.542,-0.527,-0.51,-0.493,-0.476,-0.459,-0.442,-0.424,-0.407,-0.39,-0.373,-0.357,-0.341,-0.325,-0.31,-0.294,-0.279,-0.262,-0.245,-0.227,-0.208,-0.189,-0.17,-0.151,-0.134,-0.116,-0.099,-0.08,-0.061,-0.041,-0.019,0.002,0.025,0.047,0.069,0.092,0.115,0.142,0.169,0.197,0.226,0.255,0.284,0.313,0.343,0.373,0.403,0.433,0.464,0.494,0.525]},"frac":0.2055,"n_boot":500,"series_id":"gistemp_glb","span_years":30.0,"years":[1850,1851,1852,1853,1854,1855,1856,1857,1858,1859,1860,1861,1862,1863,1864,1865,1866,1867,1868,1869,1870,1871,1872,1873,1874,1875,1876,1877,1878,1879,1880,1881,1882,1883,1884,1885,1886,1887,1888,1889,1890,1891,1892,1893,1894,1895,1896,1897,1898,1899,1900,1901,1902,1903,1904,1905,1906,1907,1908,1909,1910,1911,1912,1913,1914,1915,1916,1917,1918,1919,1920,1921,1922,1923,1924,1925,1926,1927,1928,1929,1930,1931,1932,1933,1934,1935,1936,1937,1938,1939,1940,1941,1942,1943,1944,1945,1946,1947,1948,1949,1950,1951,1952,1953,1954,1955,1956,1957,1958,1959,1960,1961,1962,1963,1964,1965,1966,1967,1968,1969,1970,1971,1972,1973,1974,1975,1976,1977,1978,1979,1980,1981,1982,1983,1984,1985,1986,1987,1988,1989,1990,1991,1992,1993,1994,1995,1996,1997,1998,1999,2000,2001,2002,2003,2004,2005,2006,2007,2008,2009,2010,2011,2012,2013,2014,2015,2016,2017,2018,2019,2020,2021,2022,2023,2024,2025]},{"band_hi":{"1850-1900":[0.113,0.105,0.097,0.088,0.077,0.069,0.062,0.056,0.052,0.045,0.041,0.039,0.037,0.036,0.038,0.039,0.041,0.042,0.044,0.047,0.049,0.051,0.054,0.056,0.059,0.062,0.062,0.063,0.066,0.061,0.059,0.056,0.053,0.048,0.044,0.038,0.035,0.031,0.027,0.021,0.015,0.011,0.007,0.003,-0.001,-0.005,-0.009,-0.011,-0.013,-0.015,-0.017,-0.018,-0.019,-0.02,-0.02,-0.022,-0.023,-0.025,-0.022,-0.02,-0.015,-0.007,-0.003,0.002,0.012,0.021,0.029,0.038,0.048,0.059,0.072,0.084,0.095,0.11,0.125,0.14,0.156,0.169,0.183,0.198,0.21,0.223,0.235,0.247,0.26,0.273,0.285,0.294,0.303,0.311,0.316,0.319,0.322,0.324,0.326,0.327,0.326,0.323,0.32,0.315,0.313,0.309,0.307,0.304,0.301,0.298,0.297,0.296,0.294,0.292,0.292,0.293,0.292,0.292,0.296,0.298,0.301,0.307,0.311,0.319,0.327,0.339,0.351,0.364,0.376,0.39,0.404,0.418,0.433,0.451,0.468,0.486,0.503,0.52,0.536,0.553,0.569,0.587,0.607,0.625,0.646,0.665,0.685,0.704,0.721,0.74,0.757,0.776,0.795,0.814,0.833,0.851,0.872,0.892,0.914,0.937,0.959,0.982,1.005,1.027,1.05,1.074,1.1,1.124,1.148,1.175,1.201,1.229,1.258,1.29,1.322,1.355,1.389,1.421,1.454,1.487],"1951-1980":[-0.164,-0.172,-0.18,-0.188,-0.199,-0.207,-0.215,-0.221,-0.225,-0.232,-0.235,-0.238,-0.239,-0.24,-0.238,-0.237,-0.236,-0.235,-0.233,-0.23,-0.227,-0.225,-0.223,-0.221,-0.217,-0.215,-0.215,-0.213,-0.21,-0.215,-0.218,-0.22,-0.223,-0.228,-0.232,-0.239,-0.242,-0.245,-0.25,-0.256,-0.261,-0.266,-0.269,-0.273,-0.278,-0.282,-0.285,-0.288,-0.29,-0.292,-0.294,-0.294,-0.295,-0.296,-0.297,-0.298,-0.3,-0.301,-0.299,-0.296,-0.291,-0.284,-0.279,-0.274,-0.265,-0.256,-0.247,-0.238,-0.228,-0.218,-0.205,-0.192,-0.181,-0.166,-0.151,-0.136,-0.121,-0.107,-0.093,-0.079,-0.066,-0.053,-0.042,-0.03,-0.017,-0.003,0.008,0.017,0.027,0.034,0.04,0.043,0.045,0.048,0.049,0.051,0.05,0.047,0.044,0.038,0.036,0.033,0.03,0.027,0.024,0.022,0.02,0.019,0.018,0.016,0.016,0.016,0.016,0.016,0.02,0.021,0.025,0.031,0.035,0.043,0.051,0.062,0.074,0.087,0.1,0.113,0.128,0.142,0.157,0.174,0.192,0.209,0.226,0.244,0.26,0.277,0.293,0.31,0.33,0.349,0.37,0.389,0.408,0.427,0.445,0.464,0.481,0.5,0.519,0.538,0.557,0.575,0.596,0.615,0.637,0.661,0.683,0.705,0.728,0.751,0.774,0.798,0.824,0.848,0.872,0.898,0.924,0.953,0.982,1.013,1.046,1.079,1.112,1.145,1.178,1.211],"19